{
  "$schema": "../area.schema.json",
  "id": "costs",
  "name": "עלויות",
  "kind": "area",
  "distribution": "internal",
  "category": "ops",
  "core": false,
  "toggleable": true,
  "alwaysOn": [],
  "owns": [
    "apps/web/app/api/v1/admin/costs/"
  ],
  "description": "AI and infra cost tracking and caps."
}
