{
  "$schema": "../area.schema.json",
  "id": "gideon",
  "name": "גדעון (בוט מנכ\"ל)",
  "kind": "area",
  "distribution": "internal",
  "category": "ops",
  "core": false,
  "toggleable": true,
  "alwaysOn": [],
  "owns": [
    "apps/web/app/api/v1/admin/ceo/",
    "apps/web/components/gideon/",
    "apps/web/lib/ceo/",
    "apps/web/lib/module-api/gideon/"
  ],
  "description": "Gideon, the owner's CEO bot.",
  "api": [
    "apps/web/lib/module-api/gideon/"
  ]
}
