{
  "$schema": "../area.schema.json",
  "id": "logs",
  "name": "יומנים",
  "kind": "area",
  "distribution": "shareable",
  "category": "ops",
  "core": true,
  "toggleable": false,
  "alwaysOn": [
    "error-logs"
  ],
  "owns": [
    "apps/web/lib/logs/",
    "apps/web/lib/logging/",
    "apps/web/components/ops-logs/",
    "apps/web/app/api/v1/ai/cron/log-retention/"
  ],
  "description": "Structured logs, error capture and retention."
}
