{
  "$schema": "../area.schema.json",
  "id": "a11y",
  "name": "נגישות",
  "kind": "area",
  "distribution": "sellable",
  "category": "ui",
  "core": false,
  "toggleable": true,
  "alwaysOn": [],
  "owns": [
    "apps/web/lib/a11y/",
    "apps/web/components/a11y/",
    "apps/web/app/accessibility/"
  ],
  "description": "Accessibility preferences and tools (behavior unchanged)."
}
