{
  "$schema": "../area.schema.json",
  "id": "notifications",
  "name": "התראות למשתמשים",
  "kind": "area",
  "distribution": "shareable",
  "category": "messaging",
  "core": false,
  "toggleable": true,
  "alwaysOn": [],
  "owns": [
    "apps/web/app/api/v1/notifications/",
    "apps/web/components/notifications/",
    "apps/web/lib/email/",
    "apps/web/lib/module-api/notifications/",
    "apps/web/lib/notifications/",
    "apps/web/lib/push/"
  ],
  "description": "Event-driven email, Telegram, WhatsApp and push.",
  "api": [
    "apps/web/lib/module-api/notifications/"
  ]
}
