{
  "$schema": "../area.schema.json",
  "id": "site-content",
  "name": "תוכן האתר ומדיה",
  "kind": "area",
  "distribution": "internal",
  "category": "content",
  "core": false,
  "toggleable": true,
  "alwaysOn": [],
  "owns": [
    "apps/web/app/about/",
    "apps/web/app/coming-soon/",
    "apps/web/app/contact/",
    "apps/web/app/landing-v2/",
    "apps/web/components/coming-soon/",
    "apps/web/components/landing/",
    "apps/web/components/media-manager/",
    "apps/web/components/media/",
    "apps/web/lib/cdn/",
    "apps/web/lib/coming-soon/",
    "apps/web/lib/media-manager/",
    "apps/web/lib/media/",
    "apps/web/lib/module-api/site-content/",
    "apps/web/lib/storage/"
  ],
  "description": "Site content, media library, storage and CDN.",
  "api": [
    "apps/web/lib/module-api/site-content/"
  ]
}
