{
  "$schema": "../area.schema.json",
  "id": "audit-log",
  "name": "יומן ביקורת",
  "kind": "area",
  "distribution": "internal",
  "category": "security",
  "core": true,
  "toggleable": false,
  "alwaysOn": [
    "append-only-audit"
  ],
  "owns": [
    "apps/web/app/api/v1/ai/cron/session-trail-seal/"
  ],
  "description": "Append-only audit trail and session-trail sealing."
}
