{
  "$schema": "../area.schema.json",
  "id": "privacy-retention",
  "name": "פרטיות ושמירה",
  "kind": "area",
  "distribution": "shareable",
  "category": "privacy",
  "core": false,
  "toggleable": false,
  "alwaysOn": [
    "consents",
    "data-export",
    "deletion-with-approval"
  ],
  "owns": [
    "apps/web/lib/privacy/",
    "apps/web/app/api/v1/admin/privacy-compliance/",
    "apps/web/app/api/v1/account/health-consent/",
    "apps/web/app/api/v1/account/transcript-access-consent/",
    "apps/web/components/privacy/",
    "apps/web/app/privacy/",
    "apps/web/app/cookies/"
  ],
  "description": "Consents, retention, export and deletion (never without approval)."
}
