{
  "$schema": "../area.schema.json",
  "id": "agent",
  "name": "מנוע סוכן",
  "kind": "area",
  "distribution": "internal",
  "category": "ai",
  "core": false,
  "toggleable": true,
  "alwaysOn": [],
  "owns": [
    "apps/web/lib/ai/",
    "apps/web/lib/almog/",
    "apps/web/components/ai/",
    "apps/web/lib/tts/",
    "apps/web/lib/audio/",
    "apps/web/lib/safety/",
    "apps/web/lib/mentors/",
    "apps/web/components/mentorship/",
    "apps/web/components/summaries/",
    "apps/web/app/api/v1/ai/",
    "apps/web/app/api/admin/",
    "apps/web/app/api/v1/almog-assignments/",
    "apps/web/app/api/v1/almog-avatar/",
    "apps/web/app/api/v1/almog-blockers/",
    "apps/web/app/api/v1/almog-task-celebration/",
    "apps/web/app/api/v1/public/landing-chat/",
    "apps/web/app/ops/debug-rag/",
    "apps/web/components/insights/",
    "apps/web/components/audio/",
    "apps/web/components/safety/",
    "apps/web/app/api/summaries/",
    "apps/web/app/(dashboard)/summaries/",
    "apps/web/scripts/measure-reply-qc.ts",
    "apps/web/scripts/test-ai-chat.mjs",
    "apps/web/scripts/backfill-insight-vectors-upstash.mjs",
    "apps/web/app/api/v1/mentors/"
  ],
  "description": "The Almog agent engine: chat, routing, prompts, memory, safety, voice. Locked by the Almog golden test."
}
