{
  "$schema": "../area.schema.json",
  "id": "billing",
  "name": "תשלומים",
  "kind": "area",
  "distribution": "shareable",
  "category": "commerce",
  "core": false,
  "toggleable": true,
  "alwaysOn": [],
  "owns": [
    "apps/web/app/(dashboard)/plans/",
    "apps/web/app/api/v1/billing/",
    "apps/web/components/billing/",
    "apps/web/components/plans/",
    "apps/web/lib/billing/",
    "apps/web/lib/module-api/billing/",
    "apps/web/lib/plans/"
  ],
  "description": "Subscriptions, perpetual licenses, plans and module gating.",
  "api": [
    "apps/web/lib/module-api/billing/"
  ]
}
