{
  "$schema": "../area.schema.json",
  "id": "incident-response",
  "name": "תגובה לאירועים",
  "kind": "area",
  "distribution": "internal",
  "category": "security",
  "core": true,
  "toggleable": false,
  "alwaysOn": [
    "incident-playbook"
  ],
  "owns": [
    "apps/web/app/api/v1/ops/security/",
    "apps/web/app/api/v1/admin/ceo/security/"
  ],
  "description": "Incident response: security events, lockdown, CEO security view."
}
